{
  "$schema": "https://opensource.adobe.com/spectrum-design-data/schemas/platform-extension.json",
  "platform": "Web Components",
  "platformVersion": "Spectrum Web Components 0.x+",
  "description": "Web Components-specific terminology for transient interaction states",
  "extends": "interactions",
  "extensions": [
    {
      "termId": "hover",
      "platformTerm": "hover",
      "notes": "Implemented via CSS :hover pseudo-class",
      "reference": ":hover pseudo-class",
      "codeExample": ":host(:hover) { ... }",
      "differences": [
        "Automatically handled by browser CSS",
        "Works with any pointing device",
        "No JavaScript required for basic hover states"
      ]
    },
    {
      "termId": "focus",
      "platformTerm": "focused",
      "platformAliases": ["focus", "focus-visible"],
      "notes": "Uses :focus and :focus-visible pseudo-classes. :focus-visible additionally distinguishes keyboard-driven focus from pointer/programmatic focus, showing a visible focus ring only for keyboard navigation.",
      "reference": ":focus-visible",
      "codeExample": ":host(:focus-visible) { outline: 2px solid blue; }",
      "differences": [
        "Distinguishes between programmatic and user-initiated focus",
        ":focus-visible shows a focus ring only for keyboard navigation",
        "Better accessibility with :focus-visible support"
      ]
    }
  ]
}
